You may have been told when you were younger that you shouldn’t talk with your mouth full. Eating habits are viewed very differently by different cultures. At a British dinner table it would be seen as rude to slurp your food and drink. In which country is slurping a compliment?	Japan
When taking a picture you may see people motioning the “rabbit ears” sign behind another person’s head. In countries such as Britain this is done in a harmless, playful manner. However, when done to a Brazilian man what are you seen to be suggesting? (Hint: Horn sign that we saw in class)	That he has an adulterous wife
The "OK" sign made by forming a circle with your thumb and forefinger is generally used by Britons and Americans to tell each other that everything is fine. What less flattering symbol would a Kuwaiti take this gesture to be?	The evil eye
The “OK” hand gesture in Western Culture, means what in Japan ?	Money.
What act, seen as homosexual in westernized countries, is a very common sign of friendship in India, Muslim countries and African countries?	Two men holding hands
When an Arabic person brings the tips of all fingers and thumb together and bobs the hand up and down, this means…	Calm down
Which one of the following gestures is an insult to a cheated husband? 	Horn ears
What are you going to lose in Japan, if someone does “the neck slide” gesture to you:	Your job
Different version of the same gesture may have different meanings even in the same country. When Ronnie James Dio, a rock legend, popularizes the following gesture in heavy metal community by seeing his grandmother doing the same gesture implying ...	Warding of the evil eye
